{
  "schemaVersion": "fluxball-four-qubit-hybrid-fixture-bank-v1",
  "fixtureBankId": "fluxball-aer-four-qubit-hybrid-v1",
  "defaultFixtureId": "fluxball-four-player-hybrid-preparation-v1",
  "compiledAt": "2026-08-20T02:56:11+00:00",
  "deliveryMode": "committed-fixture",
  "acquisitionSource": "finite-shot-aer",
  "derivationMethod": "joint-counts-plus-pairwise-lstsq-psd",
  "model": {
    "modelId": "fluxball-four-qubit-rulefield-hybrid-v1",
    "numQubits": 4,
    "playerOrder": ["A", "B", "C", "D"],
    "qubitMap": [
      {
        "qubit": 0,
        "playerId": "A",
        "displayName": "Player A"
      },
      {
        "qubit": 1,
        "playerId": "B",
        "displayName": "Player B"
      },
      {
        "qubit": 2,
        "playerId": "C",
        "displayName": "Player C"
      },
      {
        "qubit": 3,
        "playerId": "D",
        "displayName": "Player D"
      }
    ],
    "configuredEdges": [
      [0, 2],
      [2, 1],
      [1, 3],
      [3, 0]
    ],
    "characterizedEdges": [
      [0, 2],
      [0, 3],
      [1, 2],
      [1, 3]
    ],
    "topologyKind": "four-player-court-ring",
    "initialCircuit": {
      "format": "OPENQASM 2",
      "sha256": "6f03bbb41c61468ea12c745a75a546861786fa5888a619e9de4361ad54d5cc47",
      "depth": 7,
      "twoQubitDepth": 4,
      "operationCounts": {
        "cx": 4,
        "ry": 8,
        "rz": 4
      },
      "serialization": "OPENQASM 2.0;\ninclude \"qelib1.inc\";\nqreg q[4];\nry(-pi/2) q[0];\nry(pi/3) q[1];\nry(-pi/4) q[2];\nry(2*pi/5) q[3];\ncx q[0],q[2];\ncx q[2],q[1];\ncx q[1],q[3];\ncx q[3],q[0];\nrz(pi/3) q[0];\nry(11*pi/12) q[0];\nrz(pi/5) q[1];\nry(-7*pi/12) q[1];\nrz(pi/7) q[2];\nry(5*pi/8) q[2];\nrz(pi/11) q[3];\nry(-3*pi/10) q[3];"
    }
  },
  "provenance": {
    "python": "3.9.6",
    "platform": "macOS-26.5.2-arm64-arm-64bit",
    "packageVersions": {
      "quantumgraph": "0.0.1",
      "pairwise-tomography": "0.1.0",
      "qiskit": "2.2.3",
      "qiskit-aer": "0.17.2",
      "numpy": "2.0.2",
      "scipy": "1.13.1"
    },
    "quantumGraphCommit": "6917364b9496bd324225e87e6dd986bce52ecefd",
    "pairwiseTomographyCommit": "dbab12513281bd8ca7828252cf2e98a1a5749761",
    "verifiedSources": {
      "quantumgraph": {
        "url": "https://github.com/moth-quantum/QuantumGraph.git",
        "vcs": "git",
        "commit": "6917364b9496bd324225e87e6dd986bce52ecefd",
        "requestedRevision": "6917364b9496bd324225e87e6dd986bce52ecefd",
        "directUrlSha256": "ab9452661e66536c150ee2ec10c16a1934f0622d2b1434a77ff4b021bc4b428f"
      },
      "pairwise-tomography": {
        "url": "https://github.com/moth-quantum/pairwise-tomography.git",
        "vcs": "git",
        "commit": "dbab12513281bd8ca7828252cf2e98a1a5749761",
        "requestedRevision": "dbab12513281bd8ca7828252cf2e98a1a5749761",
        "directUrlSha256": "ae42a6633e7cdb1a326d4d332b542cfec2653f3087f3210c3c64e6d33d0553ae"
      }
    },
    "sourceRelationship": "QuantumGraph constructs and normalizes the reviewed court-ring coupling map; an ExpectationValue k=2 backend avoids a redundant finite-shot acquisition during graph construction. After the authored preparation is installed on that graph, the pinned pairwise-tomography package generates one nine-setting bipartite batch and fits all four edge density matrices. The three uniform settings in that same batch supply the complete A/B/C/D gameplay distributions; edges are explanatory and are never sampled independently during play.",
    "lineage": "Fluxball follows Quantum Royale's offline QuantumGraph and pairwise-tomography acquisition pattern, but adds full-register sampling so four players receive one compatible joint rule outcome.",
    "qpu": false,
    "remoteService": false,
    "mothApi": false
  },
  "costEstimate": {
    "fixtureCount": 1,
    "characterizationCircuitsPerFixture": 9,
    "totalCircuitExecutions": 9,
    "shotsPerCircuit": 4096,
    "totalShots": 36864
  },
  "fixtures": {
    "fluxball-four-player-hybrid-preparation-v1": {
      "fixtureId": "fluxball-four-player-hybrid-preparation-v1",
      "circuit": {
        "format": "OPENQASM 2",
        "sha256": "6f03bbb41c61468ea12c745a75a546861786fa5888a619e9de4361ad54d5cc47",
        "depth": 7,
        "twoQubitDepth": 4,
        "operationCounts": {
          "cx": 4,
          "ry": 8,
          "rz": 4
        },
        "serialization": "OPENQASM 2.0;\ninclude \"qelib1.inc\";\nqreg q[4];\nry(-pi/2) q[0];\nry(pi/3) q[1];\nry(-pi/4) q[2];\nry(2*pi/5) q[3];\ncx q[0],q[2];\ncx q[2],q[1];\ncx q[1],q[3];\ncx q[3],q[0];\nrz(pi/3) q[0];\nry(11*pi/12) q[0];\nrz(pi/5) q[1];\nry(-7*pi/12) q[1];\nrz(pi/7) q[2];\nry(5*pi/8) q[2];\nrz(pi/11) q[3];\nry(-3*pi/10) q[3];"
      },
      "acquisition": {
        "backendClass": "AerSimulator",
        "backendName": "aer_simulator",
        "providerMode": "local-aer",
        "providerName": "qiskit-aer",
        "mothApi": false,
        "jobId": "155420f0-2462-4ed9-90cb-ebeebcfa6f54",
        "shotsPerCircuit": 4096,
        "simulatorSeed": 260818,
        "transpilerSeed": 260818,
        "characterizationCircuitCount": 9,
        "measurementSettings": [
          "XXXX",
          "XXYY",
          "XXZZ",
          "YYXX",
          "YYYY",
          "YYZZ",
          "ZZXX",
          "ZZYY",
          "ZZZZ"
        ],
        "uniformGameplaySettings": {
          "X": "XXXX",
          "Y": "YYYY",
          "Z": "ZZZZ"
        },
        "totalShots": 36864,
        "logicalMeasurementCircuitQasm": [
          "OPENQASM 2.0;\ninclude \"qelib1.inc\";\nqreg q[4];\ncreg c0[4];\nry(-pi/2) q[0];\nry(pi/3) q[1];\nry(-pi/4) q[2];\nry(2*pi/5) q[3];\ncx q[0],q[2];\ncx q[2],q[1];\ncx q[1],q[3];\ncx q[3],q[0];\nrz(pi/3) q[0];\nry(11*pi/12) q[0];\nrz(pi/5) q[1];\nry(-7*pi/12) q[1];\nrz(pi/7) q[2];\nry(5*pi/8) q[2];\nrz(pi/11) q[3];\nry(-3*pi/10) q[3];\nh q[0];\nmeasure q[0] -> c0[0];\nh q[1];\nmeasure q[1] -> c0[1];\nh q[2];\nmeasure q[2] -> c0[2];\nh q[3];\nmeasure q[3] -> c0[3];",
          "OPENQASM 2.0;\ninclude \"qelib1.inc\";\nqreg q[4];\ncreg c0[4];\nry(-pi/2) q[0];\nry(pi/3) q[1];\nry(-pi/4) q[2];\nry(2*pi/5) q[3];\ncx q[0],q[2];\ncx q[2],q[1];\ncx q[1],q[3];\ncx q[3],q[0];\nrz(pi/3) q[0];\nry(11*pi/12) q[0];\nrz(pi/5) q[1];\nry(-7*pi/12) q[1];\nrz(pi/7) q[2];\nry(5*pi/8) q[2];\nrz(pi/11) q[3];\nry(-3*pi/10) q[3];\nh q[0];\nmeasure q[0] -> c0[0];\nh q[1];\nmeasure q[1] -> c0[1];\nsdg q[2];\nh q[2];\nmeasure q[2] -> c0[2];\nsdg q[3];\nh q[3];\nmeasure q[3] -> c0[3];",
          "OPENQASM 2.0;\ninclude \"qelib1.inc\";\nqreg q[4];\ncreg c0[4];\nry(-pi/2) q[0];\nry(pi/3) q[1];\nry(-pi/4) q[2];\nry(2*pi/5) q[3];\ncx q[0],q[2];\ncx q[2],q[1];\ncx q[1],q[3];\ncx q[3],q[0];\nrz(pi/3) q[0];\nry(11*pi/12) q[0];\nrz(pi/5) q[1];\nry(-7*pi/12) q[1];\nrz(pi/7) q[2];\nry(5*pi/8) q[2];\nrz(pi/11) q[3];\nry(-3*pi/10) q[3];\nh q[0];\nmeasure q[0] -> c0[0];\nh q[1];\nmeasure q[1] -> c0[1];\nmeasure q[2] -> c0[2];\nmeasure q[3] -> c0[3];",
          "OPENQASM 2.0;\ninclude \"qelib1.inc\";\nqreg q[4];\ncreg c0[4];\nry(-pi/2) q[0];\nry(pi/3) q[1];\nry(-pi/4) q[2];\nry(2*pi/5) q[3];\ncx q[0],q[2];\ncx q[2],q[1];\ncx q[1],q[3];\ncx q[3],q[0];\nrz(pi/3) q[0];\nry(11*pi/12) q[0];\nrz(pi/5) q[1];\nry(-7*pi/12) q[1];\nrz(pi/7) q[2];\nry(5*pi/8) q[2];\nrz(pi/11) q[3];\nry(-3*pi/10) q[3];\nsdg q[0];\nh q[0];\nmeasure q[0] -> c0[0];\nsdg q[1];\nh q[1];\nmeasure q[1] -> c0[1];\nh q[2];\nmeasure q[2] -> c0[2];\nh q[3];\nmeasure q[3] -> c0[3];",
          "OPENQASM 2.0;\ninclude \"qelib1.inc\";\nqreg q[4];\ncreg c0[4];\nry(-pi/2) q[0];\nry(pi/3) q[1];\nry(-pi/4) q[2];\nry(2*pi/5) q[3];\ncx q[0],q[2];\ncx q[2],q[1];\ncx q[1],q[3];\ncx q[3],q[0];\nrz(pi/3) q[0];\nry(11*pi/12) q[0];\nrz(pi/5) q[1];\nry(-7*pi/12) q[1];\nrz(pi/7) q[2];\nry(5*pi/8) q[2];\nrz(pi/11) q[3];\nry(-3*pi/10) q[3];\nsdg q[0];\nh q[0];\nmeasure q[0] -> c0[0];\nsdg q[1];\nh q[1];\nmeasure q[1] -> c0[1];\nsdg q[2];\nh q[2];\nmeasure q[2] -> c0[2];\nsdg q[3];\nh q[3];\nmeasure q[3] -> c0[3];",
          "OPENQASM 2.0;\ninclude \"qelib1.inc\";\nqreg q[4];\ncreg c0[4];\nry(-pi/2) q[0];\nry(pi/3) q[1];\nry(-pi/4) q[2];\nry(2*pi/5) q[3];\ncx q[0],q[2];\ncx q[2],q[1];\ncx q[1],q[3];\ncx q[3],q[0];\nrz(pi/3) q[0];\nry(11*pi/12) q[0];\nrz(pi/5) q[1];\nry(-7*pi/12) q[1];\nrz(pi/7) q[2];\nry(5*pi/8) q[2];\nrz(pi/11) q[3];\nry(-3*pi/10) q[3];\nsdg q[0];\nh q[0];\nmeasure q[0] -> c0[0];\nsdg q[1];\nh q[1];\nmeasure q[1] -> c0[1];\nmeasure q[2] -> c0[2];\nmeasure q[3] -> c0[3];",
          "OPENQASM 2.0;\ninclude \"qelib1.inc\";\nqreg q[4];\ncreg c0[4];\nry(-pi/2) q[0];\nry(pi/3) q[1];\nry(-pi/4) q[2];\nry(2*pi/5) q[3];\ncx q[0],q[2];\ncx q[2],q[1];\ncx q[1],q[3];\ncx q[3],q[0];\nrz(pi/3) q[0];\nry(11*pi/12) q[0];\nrz(pi/5) q[1];\nry(-7*pi/12) q[1];\nrz(pi/7) q[2];\nry(5*pi/8) q[2];\nrz(pi/11) q[3];\nry(-3*pi/10) q[3];\nmeasure q[0] -> c0[0];\nmeasure q[1] -> c0[1];\nh q[2];\nmeasure q[2] -> c0[2];\nh q[3];\nmeasure q[3] -> c0[3];",
          "OPENQASM 2.0;\ninclude \"qelib1.inc\";\nqreg q[4];\ncreg c0[4];\nry(-pi/2) q[0];\nry(pi/3) q[1];\nry(-pi/4) q[2];\nry(2*pi/5) q[3];\ncx q[0],q[2];\ncx q[2],q[1];\ncx q[1],q[3];\ncx q[3],q[0];\nrz(pi/3) q[0];\nry(11*pi/12) q[0];\nrz(pi/5) q[1];\nry(-7*pi/12) q[1];\nrz(pi/7) q[2];\nry(5*pi/8) q[2];\nrz(pi/11) q[3];\nry(-3*pi/10) q[3];\nmeasure q[0] -> c0[0];\nmeasure q[1] -> c0[1];\nsdg q[2];\nh q[2];\nmeasure q[2] -> c0[2];\nsdg q[3];\nh q[3];\nmeasure q[3] -> c0[3];",
          "OPENQASM 2.0;\ninclude \"qelib1.inc\";\nqreg q[4];\ncreg c0[4];\nry(-pi/2) q[0];\nry(pi/3) q[1];\nry(-pi/4) q[2];\nry(2*pi/5) q[3];\ncx q[0],q[2];\ncx q[2],q[1];\ncx q[1],q[3];\ncx q[3],q[0];\nrz(pi/3) q[0];\nry(11*pi/12) q[0];\nrz(pi/5) q[1];\nry(-7*pi/12) q[1];\nrz(pi/7) q[2];\nry(5*pi/8) q[2];\nrz(pi/11) q[3];\nry(-3*pi/10) q[3];\nmeasure q[0] -> c0[0];\nmeasure q[1] -> c0[1];\nmeasure q[2] -> c0[2];\nmeasure q[3] -> c0[3];"
        ],
        "logicalMeasurementCircuitSha256": [